{
  "schema_version": 1,
  "name": "point-default-label",
  "description": "A point without a label is positive and carries no prefix.",
  "input": {
    "size": {
      "width": 640,
      "height": 480
    },
    "objects": [
      {
        "id": 3,
        "prompts": [
          {
            "points": [
              {
                "x": 25,
                "y": 30
              }
            ]
          }
        ]
      }
    ]
  },
  "expected": {
    "text": "<0f>3<|point;x=25;y=30;w=640;h=480|>"
  }
}
